AEd,Abhinavarājalakṣmībhāṣāṭikā (Raghunandanaprasādaśāstrī 1935)
JEd,Jatarupa's Commentary on the Amarakosa (ed. Pant 2000)
KkEd,Subhūticandra's Kavikāmadhenu on Amarakośa 1.1.1.-1.4.8 (ed. Deokar 2014)
Kk-ST,"Kavikāmadhenu, translated by Si Tu Pan Chen (1750-1757, ed. Deokar 2014)"
Kk-N,"Kavikāmadhenu, translated by Yar klung Lo tsa ba rgyal mtshan (13th century, Narthang Tangyur)"
Kk-D,"Kavikāmadhenu, translated by Zhwa lu Lo tsa ba Chos skyong bzang po (15th/16th century, Derge Tangyur)"
KEd,"Amarakośa of Amarasimha, With the Commentary of Ācārya Kṛṣṇamitra (ed. Misra 1972)"
MsEd,Amarakoṣaḥ saṃkṣiptamāheśvaryā ṭīkayā sametaḥ (ed. Pansiker 1896)
MEd,"Amarakosa, with the commentary of Maheśvara (Amaraviveka) (ed. Talekar 1882)"
P1481,University of Pennsylvania Ms. Coll. 390 Item 1481
NcEd,Nāmacandrikā (ed. Sharma 1929)
PcEd,Padacandrikā (ed. Sastri 1966)
KA324-10,NGMPP A 324-10 (Padacandrikā)
KA322-4b,NGMPP A 322-4b (Padacandrikā)
KA323-19,NGMPP A 323-19 (Padacandrikā)
PpEd,"Amarapadapārijāta (Amarakośa With the Unpublished South Indian Commentaries, ed. Mishra 1971)"
PvG,Nāmaliṅgānuśāsanavyākhyā : Amarakōśapadavivṛtiḥ. (GOML MS 1697-1706)
PvI,"Sanskrit Academy, Osmania University MS 114/4 [via I_AM_VISIONARY_TUNES] (Padavivṛti)"
PvEd,"Padavivṛti (Amarakośa With the Unpublished South Indian Commentaries, ed. Mishra 1971)"
PvEdC,"Padavivṛti, witness C (Amarakośa With the Unpublished South Indian Commentaries, ed. Mishra 1971)"
P2824,"Padavivṛti (University of Pennsylvania MS Coll. 390 Item 2824)"
RLEd,Rasāla (Śāstrī 1937)
RPEd,Ratnaprabhā (Tripathi 1982)
ṬEd,Ṭīkāsarvasva (ed. Śāstrī 1914)
TEd(1892),Trikāṇḍacintāmaṇi (ed. Bhaṭṭācārya 1892)
TEd(1892)-note,"Bengali footnote ad Trikāṇḍacintāmaṇi (ed. Bhaṭṭācārya 1892)"
TEd(1886),Trikāṇḍacintāmaṇi (ed. Tarkaratna 1886)
UEd,Amara's Nāmaliṅgānuśāsanam with The commentary Amarakos'odghāṭana of Bhaṭṭa Kṣīrasvāmin (ed. Sharma 1941) 
VSEd,Vyākhyāsudhā (ed. Śivadatta 1929)
BnF-549,BnF Sanscrit 549 annotations
BnF-612m,BnF Sanscrit 612 marginal annotations
BnF-612r,BnF Sanscrit 612 initial commentary in red
BnF-612,BnF Sanscrit 612 initial commentary in black
BnF-614,"Amarapadavivṛti (BnF Sanscrit 614)"
BnF-619,"Padārthakaumudī (BnF Sanscrit 619)"
BnF-620,BnF Sanscrit 620
BnF-623,BnF Sanscrit 623
BnF-626,BnF Sanscrit 626
BnF-1379,BnF Sanscrit 1379 initial commentary
BnF-1379m,BnF Sanscrit 1379 marginal annotations
BnF-622,"Amarapañcikā (BnF Sanscrit 622)"
D1183,DAV College MS 1183
D1205,DAV College MS 1205
D3347,DAV College MS 3347
D3351,DAV College MS 3351
D3377,DAV College MS 3377
D4057,"Udghāṭana, incomplete (DAV College MS 4057)"
EAP729-1-1-43,"Chinmaya International Foundation, EAP729/1/1/43"
Ś242,"Shantipur Bangiya Puran Parishad, MS 242 (EAP 781/1/1/181)"
Ś427,"Shantipur Bangiya Puran Parishad, MS 427 (EAP 781/1/1/200)"
Ś344,"Shantipur Bangiya Puran Parishad, MS 344 (EAP 781/1/1/591)"
Ś591,"Shantipur Bangiya Puran Parishad, MS 591 (EAP 781/1/1/623)"
ŚA145,"Shantipur Bangiya Puran Parishad, MS A145 (EAP 781/1/1/822)"
Ś161,"Shantipur Bangiya Puran Parishad, MS 161 (EAP 781/1/1/838)"
ŚA381,"Shantipur Bangiya Puran Parishad, MS A381 (EAP 781/1/1/1061)"
ŚA482,"Shantipur Bangiya Puran Parishad, MS A482 (EAP 781/1/1/1203)"
R483,Shri Raghunatha Temple MS 483 gha
R824,Shri Raghunatha Temple MS 824 gha
R577,"Vyākhyāsudhā (Shri Raghunatha Temple MS 577 gha)"
RE22704,IFP RE22704
P743,University of Pennsylvania Ms. Coll. 390 Item 743
ABEdPc,Padacandrikā (ed. Borooah 1887)
ABEdM,"Mathureśa (abbreviated from IO SAN 1589, ed. Borooah 1887)"
ABEdR,"Ṭrikāṇḍaviveka (abbreviated from IO SAN 832, ed. Borooah 1887)"
ABEdT,"Trikāṇḍarahasya (abbreviated from IO SAN 1324, ed. Borooah 1887)"
ORI3317,"Oriental Institute, Tirupati MS 3317"
VEd,Savigrahāmarakośa (Haripaṇḍita 1864)
PEd,Prabhā (Jośī 1946)
LBS322,Lal Bahadur Shastri National Sanskrit University 02-04-322
BhoEd,Bhāṣāṭīkā (Ramaswarupa Bholanath 1925)
DhaEd,"Dharā (Manna Lal Abhimanyu, 1937)"
A122-218,Allahabad Museum MS 122-218
A122-223,Allahabad Museum MS 122-223
A125-266,Allahabad Museum MS 125-266
A126-307,Allahabad Museum MS 126-307
A131-466,Allahabad Museum MS 131-486
KA324-1,"Amaradīpikā of Kulanidhiśarmā (NGMPP B 324-1)"
KA320-13,NGMPP A 320-13
KA324-9,NGMPP A 324-9
KA322-5,NGMPP A 322-5
KB267-2,NGMPP B 267-2
KA322-4a,NGMPP A322-4a
KA1031-12,"NGMPP A 1031-12 (B 268-7)"
KA17-12(1),NGMPP A 17-12(1)
KA17-12(2),"NGMPP A 17-12(2), via catalogue (unclear if this is the same as A 17-12(1))"
KA321-15,NGMPP A 321-15
KA324-2,NGMPP A 324-2
KB1-2,"NGMPP B 1-2 (B 14-19)"
KB268-5,"NGMPP B 268-5"
KB266-6,"Amaradīpikā of Kulanidhiśarmā (NGMPP B 266-6)"
RE33660,IFP RE33660
RE32661,IFP RE32661
CAdd1698,Cambridge University MS Add. 1698
CAdd1650,Cambridge University MS Add. 1650
KE6-7,NGMPP E 6/5 (Newari.net)
KNNA2b,Asha Archives (Newari.net)
KB267-9,"NGMPP B 267-9 (same as A5 at Newari.net)"
KNNA6,Loka Ratna Tuladhar collection (Newari.net)
KNNA7,NGMPP E 4/3 (Newari.net)
GBP(Te)Ed,"Gurubālaprabodhikā in Telugu (Tiruvēṅkaṭācāryulu, 19th c.)"
GBP(Ta)Ed,"Gurubālaprabodhikā in Tamil (Tiruveṃkaṭācārya 1885, EAP918/9/8, Roja Muthiah Research Library)"
Ṭ-GBP(Ta)Ed,"Ṭīkasarvasva as printed in Gurubālaprabodhikā (Tiruveṃkaṭācārya 1885, EAP918/9/8, Roja Muthiah Research Library)"
GKH1,Gurukul Kangri Haridwar 010/415
GKH2,Gurukul Kangri Haridwar unnumbered
RDEd,Arthaprakāśikā (Raviduttaśāstrī 1904)
MPEd,Maṇiprabhā (Haragovinda Śāstrī 1957)
BKEd,Bālakṛṣṇāśramī (Bālakṛṣṇācārya 2000)
KK933,Kavikulguru Kalidas Sanskrit University MS 933
BPEd,Bālapriyā (Kaikulangara Rama Warrier 1950)
PKEd1849,Amarapadakalpataru (Rāmānujācārya 1849)
PKEd1924,Amarapadakalpataru (ed. Veṅkaṭarāmaśāstrī 1924)
Ad69312,Adyar Library MS 69312
Ad70820,Adyar Library MS 70820
Ad71010,Adyar Library MS 71010
Ad72614,Adyar Library MS 72614
RE37121,IFP RE37121
EO1272,École française d’Extrême-Orient MS 1272
RE45807,IFP RE45807
EAP248-1-81,"Vivaraṇa of Lakṣmaṇabudha (Ānandāśrama, Endangered Archives Project)"
EAP584-5-300,"Padavivṛti (Sanskrit Mahāvidyālaya, Endangered Archives Project)"
EAP584-1-88,"Folkland Centre collection, Endangered Archives Project"
RAS-W155,"Udghāṭana (Royal Asiatic Society MS Whish 155)"
EAP584-2-29,"Rajaraja Varma collection, Endangered Archives Project"
EAP886-1-21,"Padacandrikā (Raghunath Temple, Endangered Archives Project)"
RSEd,Kannada commentary of Raṅganātha Śarmā (2013)
JM278,Nāmaliṅgārdhacandrikā (Jangamwadi Math Acc. No. 278)
LREd,Kannada commentary by Lewis Rice (1873)
DEd,Devakośa arthāt Amarakośa [bhāṣā vivaraṇa mūla sahita] (Tivārī 1989 [1879])
SSEd,Bhāṣāṭīkā (Suśilā Siṃha 2018)
WL-a1240,Wellcome Library MS α1240
WL-a1293,"marginal commentary (Wellcome Library MS α1293)"
WL-b1440,"marginal commentary (Wellcome Library MS β1440)"
WL-b1442,"marginal commentary (Wellcome Library MS β1442)"
IO-458,"Mugdhabodhinī of Bharatasena (British Library MS IO SAN 458)"
IO-9,"Mugdhabodhinī of Bharatasena (British Library MS IO SAN 9)"
IO-958,"Padārthakaumudī (British Library MS IO SAN 13 [Eggeling 958])"
IO-1758,"Karnāṭakapriya Vyākhyāna of Lakṣmaṇa Śāstrī (British Library MS IO SAN 1758 [Eggeling 972])"
RE33635,"Karnāṭakapriya Vyākhyāna of Lakṣmaṇa Śāstrī (IFP RE33635)"
Ox-c.31,"Udghāṭana (Bodleian Library, MS Chandra Shum Shere c. 31)"
Ox-c.161,"Udghāṭana (Bodleian Library, MS Chandra Shum Shere c. 161)"
Ox-d.119,"Udghāṭana (Bodleian Library, MS Chandra Shum Shere d. 119)"
Ox-c.32,"Ṭīkā of Kṛṣṇamitra (Bodleian Library, MS Chandra Shum Shere c. 32)"
Ox-d.192(1),"Bodleian Library, Oxford MS Chandra Shum Shere d. 192(1)"
Ox-d.192(2),"Sudhā of Īśvaradatta (Bodleian Library, MS Chandra Shum Shere d. 192(2))"
Ox-d.196(1),"Ṭippaṇa of Lakṣmīdhara (Bodleian Library, MS Chandra Shum Shere d. 196(1))"
Ox-d.196(2),"Bodleian Library, MS Chandra Shum Shere d. 196(2)"
Ox-d.197(2),"Bodleian Library, MS Chandra Shum Shere d. 197(2), marginal commentary"
Ox-d.200,"Bodleian Library, MS Chandra Shum Shere d. 200, interlineal commentary (Śāradā)"
Ox-d.1122,"Bodleian Library, MS Chandra Shum Shere d. 1122, interlineal commentary (Śāradā)"
RAS-T144,"Trikāṇḍacintāmaṇi (Royal Asiatic Society MS Tod 144)"
RAS-T92,"Vyākhyāsudhā (Royal Asiatic Society MS Tod 92)"
RBEd,"Amara Kośa (Hiṃdī rupāntara). Ilāhābāda: Rāmanārāyaṇalāla Benīmādhava"
CSSEd,"Caukhambā Saṃskṛta Sīrīja Āphisa, 1960"
KGEd,"Nepali commentary of Kulacandra Gautama (1956?)"
KGEd1969,"Nepali commentary of Kulacandra Gautama (1969)"
AVEd,"Amarakoṣasya vātāyanāt (Nāmaliṁgānuśāsanam) (Ramā Dubaliśa 2003)"
RWTEd,"Printed by R. W. Thorpe, Vepery Mission Press, 1842"
ŚNEd,"Amarakocam (tamiḻk kuṟippuraiyuṭaṉ), N. Śrinivasan 2014"
PMEd,"Pārameśvarī (Ṭi. Si. Paramēśvaran Mūssat, 1959)"
AAEd,"Amarakosa in Burmese, commentary of Ashin Aggadhammābhivaṃsa (ed. Lokesh Chandra 1984)"
WEd,"Amarakoṣaya (Wimalajoti 1934)"
GEd,"Amarakoṣaya, in Simhala Granthārnavaya hevat sihala Gatsayura (Gunasekhara 1907)"
Tü-3085,"Tübingen Ms.Or.Fol. 3085"
SBB-13208,"Amarāmṛta of Veṅkaṭeśvara (Staatsbibliothek zu Berlin, Hs.or. 13208)"
SBB-3421,"Amarakoṣārthabhāṣāṭīkā of Nāgadeva Bhaṭṭopādhyāya (Staatsbibliothek zu Berlin, Ms.or.fol. 3421)"
SBB-11130,"interlineal commentary, Śāradā script (Staastbibliothek zu Berlin, HS.or. 11130)"
SBB-11178,"interlineal commentary, Śāradā script (Staastbibliothek zu Berlin, HS.or. 11178)"
SBB-11412,"interlineal commentary, Śāradā script (Staastbibliothek zu Berlin, HS.or. 11412)"
SBB-12032,"interlineal commentary, Śāradā script (Staastbibliothek zu Berlin, HS.or. 12032)"
SBB-Chambers804,"marginal commentary, Devanāgarī script (Staastbibliothek zu Berlin, Chambers 804)"
SBB-11554,"Padacandrikā, Śāradā script (Staatsbibliothek zu Berlin, HS.or. 11554)"
SBB-12192,"interlineal commentary, Śāradā script (Staatsbibliothek zu Berlin, HS.or. 12192)"
SBB-12578,"interlineal commentary, Śāradā script (Staatsbibliothek zu Berlin, HS.or. 12578)"
McG-6,"McGill University Library, MS Indic 6"
NKP1878,"interlineal commentary, Naval Kishore Press 1878"
ACEd,"Amarārthacandrikā (Manmathanātha Smṛtiratna Bhaṭṭācāryya, 1927)"
ĀṬEd,"Āṃdhraṭīkā (Kō. Kanakarāya Mōdaliyāra aṃḍu Kaṃpenīvāri, 1908)"
BJVEd,"Tēlugu ṭīkā, hiṃdī - iṃglīṣa paryāyapadasahitamu (Brahmaśrī Janamaṃci Vēṃkaṭasubramaṇyaśarmā, 1951)"
VBEd,"Telugu commentary of Vīra Bhadrayya (Rāmasvāmiśāstrulu āṃḍ sans, 1920)"
SEd,"Amarakoṣaḥ ‘Sudhā’saṃskṛtahindīvyākhyopetaḥ (prathamakāṇḍam) (Viśvanāthajhā 1969)"
VaiEd,"Amarakośaḥ kṛṣṇamitraviracitayā saṃskṛtaṭīkayā vaikuṇṭhīhindīvyākhyā āṅgalabhāṣānuvādena ca samalaṅkṛtaḥ [Vaikuṇṭhī only] (Satyadeva Miśra 2005)"
STVEd,"Amarakōṣamu saṃskṛtāṃdhra vivaraṇa samētamu (ed. Calamacarla Vēṅkaṭa Śēṣācāryulu 1989)"
KKŚEd,"Nāma-liṅgānuśāsana kiṃvā Amara-kośa (Keśavarāma Ka. Śāstrī 1976)"
DhKKhEd,"Amara koṣa, gujarātī vivecana (Dharmacanda Kevalacanda Khaṃḍola, ed. Harṣavadana Trivedī 2016)"
VREd,"Parīkṣā-praśnottarasahitaḥ Amarakośaḥ, savimarśa ‘rucirā’ hindī-ṭīkā-ṭippaṇīvibhūṣitaḥ (Ḍām̐ Sudhākara Mālavīyaḥ 1983)"
Z-V45A,"V45A, marginal commentary, Devanāgarī (Zysk Collection, University of Copenhagen)"
KA321-14,"NGMPP A 321-14"
KA321-14b,"NGMPP A 321-14, loose folio at the end"
KC121-1,"Commentary of Jātarūpa (NGMPP C 121-1)"
KB266-15,"Commentary of Jātarūpa (NGMPP B 266-15)"
RUEd,"Śrī Amarasiṃha viracita Amarakoṣaḥ Subbā Homanāthātmaja tanaya Rāmajī Upādhyāya kṛta nepālī bhāṣā śloka sametako (Hitaiṣī Kampanī, 1961)"
JVBEd,"Nāmaliṃgānuśāsana veṃba Amara kośa, Kannaḍa artha sahita (Ji. Viṣṇumūrti Bhaṭṭa, Maṃgalūr Priṃters, 1974)"
Kgl-Paṇḍit37,"Udghāṭana (Paṇḍit 37, Det Kgl. Bibliothek)"
Kgl-Paṇḍit38,"Padacandrikā (Paṇḍit 38, Det Kgl. Bibliothek)"
Kgl-Paṇḍit555,"Udghāṭana (Paṇḍit 555, Det Kgl. Bibliothek)"
Kgl-Nepal124,"Nepal 124, Det Kgl. Bibliothek"
GOML-R4390,"Laghubhāṣā of Ravivarman (GOML R.4390)"
GOML-R3645,"Śabdārthasandīpikā of Vidyāvinoda (GOML R.3645)"
IO-713,"Śabdārthasandīpikā of Vidyāvinoda (British Library, IO SAN 713)"
GOML-D1649,"GOML D.1649, Telugu commentary"
IO-377,"Ṭippaṇī of Rāmaśarman Tarkavāgīśa (British Library, IO SAN 377)"
IO-489,"Pradīpamañjarī of Rāmeśvara Śarman (British Library, IO SAN 489)"
IO-569,"Padamañjarī of Lokanātha (British Library, IO SAN 569)"
IO-1115,"Vaiśamyakaumudī (British Library, IO SAN 1115)"
IO-1161,"Kaumudī of Nayanānanda Śarman (British Library, IO SAN 1161)"
IO-1589,"Sārasundarī of Mathureśa (British Library, IO SAN 1589)"
IO-1324,"Trikāṇḍaviveka/Mugdhabodhinī (British Library, IO SAN 1324)"
IO-832,"Trikāṇḍaviveka (British Library, IO SAN 832)"
KB267-3,"NGMPP B 267-3, marginal commentary"
KU-MN3305,"Amarakoṣa in Śārada script with marginal commentary (MN 3305, Kurukṣetra University)"
ChPŚEd,"Ṭippaṇī of Choṭpati Śarman (Śrīveṅkaṭeśvara Steam Press, 1917)"
BRNRI-B18,"Anonymous printed commentary (Bhagavad Ramanuja National Research Institute, B-18)"
RE339933,"Amarapañcikā Amaravyākhyā (IFP, MS RE339933)"
LD85857,"Marginal commentary, MS 85857, Lalbhai Dalpatbhai Instititute of Indology"
LD82952,"Marginal commentary, MS 82952, Lalbhai Dalpatbhai Instititute of Indology"
LD81415,"Marginal commentary, MS 81415, Lalbhai Dalpatbhai Instititute of Indology"
LD80856,"Udghāṭana (MS 80856, Lalbhai Dalpatbhai Instititute of Indology)"
LD80856m,"Marginal commentary, MS 80856, Lalbhai Dalpatbhai Instititute of Indology"
LD61513,"MS 61513, Lalbhai Dalpatbhai Instititute of Indology"
LD45475,"Interlineal commentary, MS 45475, Lalbhai Dalpatbhai Instititute of Indology"
LD26243,"Marginal commentary, MS 26243, Lalbhai Dalpatbhai Instititute of Indology"
LD19271,"Marginal & interlineal commentary, MS 19271, Lalbhai Dalpatbhai Instititute of Indology"
LD18362,"Initial commentary, MS 18362, Lalbhai Dalpatbhai Instititute of Indology"
LD17952,"Marginal commentary, MS 17952, Lalbhai Dalpatbhai Instititute of Indology"
LD17953,"Marginal commentary, MS 17953, Lalbhai Dalpatbhai Instititute of Indology"
LD12235,"Padavivṛti (MS 12235, Lalbhai Dalpatbhai Instititute of Indology)"
LD6277,"Marginal commentary, MS 6277, Lalbhai Dalpatbhai Instititute of Indology"
LD841,"Udghāṭana (MS 841, Lalbhai Dalpatbhai Instititute of Indology)"
LD18333,"Marginal commentary, MS 18333, Lalbhai Dalpatbhai Instititute of Indology"
LD26824,"Vyākhyāsudhā, with marginal notes (MS 26824, Lalbhai Dalpatbhai Instititute of Indology)"
LD82088,"Vyākhyāsudhā (MS 82088, Lalbhai Dalpatbhai Instititute of Indology)"
UT-MF13-3-2,"Marginal commentary, MS MF13_03_002, Institute of Oriental Culture, University of Tokyo"
NM-57.106/699,"Tripāṭha commentary with marginal notes, MS 57.106/699, National Museum, Delhi"
EAP921/6/3/189,"Single folio fragment, Sisir Bani Mandir Pathagar, Guptipara, Hooghly (EAP921/6/3/189)"
EAP1031/1/52,"Mugdhabodhinī, Akshay Granthagar Library, Shantipur, Nadia, West Bengal (EAP1031/1/52)"
RamEd,"‘Ramaṇa’ hindīṭīkā (Kanhaiyālāla Jośī, 1982)"
EAP921/6/3/24,"Marginal commentary, Sisir Bani Mandir Pathagar, Guptipara, Hooghly (EAP921/6/3/24)"
EAP921/6/3/10,"Marginal commentary, Sisir Bani Mandir Pathagar, Guptipara, Hooghly (EAP921/6/3/10)"
EAP921/6/3/140,"Marginal commentary, Sisir Bani Mandir Pathagar, Guptipara, Hooghly (EAP921/6/3/140)"
EAP1031/1/228,"Marginal commentary, Akshay Granthagar, Shantipur Nadia, West bengal (EAP1031/1/228)"
EAP1031/1/211,"Marginal commentary, Akshay Granthagar, Shantipur Nadia, West bengal (EAP1031/1/211)"
EAP1031/1/166,"Marginal commentary, Akshay Granthagar, Shantipur Nadia, West bengal (EAP1031/1/166)"
EAP1304/1/260,"Ṭikāsarvasva, Vadakke Madham Brahmaswam Vedic Research Centre, Thrissur, Kerala (EAP1304/1/260)"
GOML-D3097,"Amaramuku āṃḍravyākhyānamu (paper manuscript, GOML D3097)"
Mysore1927,"Amarakōśa prathamakāṃḍamu, (9th edition, Department of Public Instruction, Mysore, 1927)"
"VVRI-59/6097","MS 59,6097, Catalogue of VVRI. Manuscript Collection, Part II (ed. Vishva Bandhu et al. 1959, 426)"
GOML-R3356,"Anonymous commentary, GOML R3356 (transcribed from Triennial catalogue, IV, 4999; to be completed)"
MEd-Pra,"Prastāvanā to the Amaraviveka (Jhaḷakīkar Bhaṭṭavāmanācāryaśarmā, 1896)"
CaDhāEd,"Candrikā of Candradhārīsiṃhaśarman (Bihar: Kameshwar Singh Darbhanga Sanskrit University, 2001)"
MWEd,"Ṭippaṇi of Ṭi. Vi. Mādhavavāriyar (Kunnaṃkuḷam: Kanippayur Panchangam, 2012)"
MLI040,"Marginal commentary, MLI040 (indianmanuscripts.com)"
MLI043,"Udghāṭana, MLI043 (indianmanuscripts.com)"
